{
  "$schema": "http://json-schema.org/draft-07/schema#",
  "$id": "intraday_source_item",
  "title": "Intraday Source Item",
  "description": "Raw item fetched from any configured source before normalization. All source adapters (RSS, API, webhook, X/social) must produce this shape.",
  "type": "object",
  "required": [
    "source_id",
    "source_name",
    "source_type",
    "title",
    "fetched_at"
  ],
  "properties": {
    "source_id": {
      "type": "string",
      "description": "Unique identifier assigned by the originating source (e.g. RSS guid, API record id, tweet id)."
    },
    "source_slug": {
      "type": ["string", "null"],
      "description": "Stable registry identifier for the source (e.g. 'coindesk-rss', 'x-account-whale-alert'). Populated from the D1 sources table when available. Null for unconfigured or ad-hoc sources."
    },
    "source_name": {
      "type": "string",
      "description": "Human-readable label for the source (e.g. 'CoinDesk RSS', 'Reuters API')."
    },
    "source_type": {
      "type": "string",
      "enum": ["rss", "api", "social", "webhook", "x_account", "x_query"],
      "description": "Technical source category. x_account and x_query are first-class types for X (Twitter) monitoring. Use 'api' for official data releases, market data APIs, and structured feeds. Use 'rss' for news and research/official RSS/Atom feeds. Use 'social' for generic social channels (Telegram, Reddit)."
    },
    "source_url": {
      "type": ["string", "null"],
      "format": "uri",
      "description": "Canonical URL of the original item. Null when not available."
    },
    "title": {
      "type": "string",
      "description": "Raw title or headline from the source."
    },
    "body": {
      "type": ["string", "null"],
      "description": "Raw body text or description from the source. Null when not available."
    },
    "author": {
      "type": ["string", "null"],
      "description": "Author name, journalist byline, or X account handle (@username) when provided by the source. Null when not available."
    },
    "published_at": {
      "type": ["string", "null"],
      "format": "date-time",
      "description": "Publication timestamp from the source (ISO-8601). Null if the source does not provide one."
    },
    "fetched_at": {
      "type": "string",
      "format": "date-time",
      "description": "UTC timestamp when the item was fetched by the ingestion step (ISO-8601)."
    },
    "raw_json": {
      "type": ["object", "null"],
      "description": "Original source payload preserved for debugging and re-processing."
    }
  },
  "additionalProperties": false,
  "examples": [
    {
      "_comment": "news — RSS specialist outlet",
      "source_id": "https://www.coindesk.com/markets/2025/01/15/bitcoin-hits-new-ath/",
      "source_slug": "coindesk-rss",
      "source_name": "CoinDesk RSS",
      "source_type": "rss",
      "source_url": "https://www.coindesk.com/markets/2025/01/15/bitcoin-hits-new-ath/",
      "title": "Bitcoin Hits New All-Time High Above $120K",
      "body": "Bitcoin surged past $120,000 on Wednesday, setting a new all-time high...",
      "author": "Omkar Godbole",
      "published_at": "2025-01-15T14:32:00Z",
      "fetched_at": "2025-01-15T14:45:00Z",
      "raw_json": {
        "guid": "https://www.coindesk.com/markets/2025/01/15/bitcoin-hits-new-ath/",
        "link": "https://www.coindesk.com/markets/2025/01/15/bitcoin-hits-new-ath/",
        "pubDate": "Wed, 15 Jan 2025 14:32:00 +0000",
        "category": ["Markets", "Bitcoin"]
      }
    },
    {
      "_comment": "official — government/agency RSS",
      "source_id": "https://www.bls.gov/news.release/cpi.nr0.htm",
      "source_slug": "bls-rss",
      "source_name": "BLS News RSS",
      "source_type": "rss",
      "source_url": "https://www.bls.gov/news.release/cpi.nr0.htm",
      "title": "Consumer Price Index — December 2024",
      "body": "The Consumer Price Index for All Urban Consumers rose 0.3 percent in December on a seasonally adjusted basis...",
      "author": null,
      "published_at": "2025-01-15T13:30:00Z",
      "fetched_at": "2025-01-15T13:32:00Z",
      "raw_json": {
        "guid": "https://www.bls.gov/news.release/cpi.nr0.htm",
        "pubDate": "Wed, 15 Jan 2025 13:30:00 +0000"
      }
    },
    {
      "_comment": "data — structured API response",
      "source_id": "coingecko-btc-2025-01-15T14:00:00Z",
      "source_slug": "coingecko-api",
      "source_name": "CoinGecko API",
      "source_type": "api",
      "source_url": "https://api.coingecko.com/api/v3/simple/price?ids=bitcoin&vs_currencies=usd",
      "title": "Bitcoin price alert: $120,432 (+8.2% 24h)",
      "body": null,
      "author": null,
      "published_at": "2025-01-15T14:00:00Z",
      "fetched_at": "2025-01-15T14:01:05Z",
      "raw_json": {
        "bitcoin": { "usd": 120432, "usd_24h_change": 8.2, "usd_market_cap": 2380000000000 }
      }
    },
    {
      "_comment": "research — pre-print / academic RSS",
      "source_id": "https://arxiv.org/abs/2501.12345",
      "source_slug": "arxiv-cs-ai-rss",
      "source_name": "arXiv cs.AI RSS",
      "source_type": "rss",
      "source_url": "https://arxiv.org/abs/2501.12345",
      "title": "Scaling Laws for Next-Token Prediction Beyond 1T Parameters",
      "body": "We present empirical scaling laws for autoregressive language models trained at scales beyond 1 trillion parameters...",
      "author": "Jane Smith, John Doe, et al.",
      "published_at": "2025-01-14T00:00:00Z",
      "fetched_at": "2025-01-15T06:00:00Z",
      "raw_json": {
        "guid": "https://arxiv.org/abs/2501.12345",
        "category": "cs.AI",
        "dc:creator": "Jane Smith, John Doe"
      }
    },
    {
      "_comment": "X/social — account monitoring",
      "source_id": "x-1879012345678901234",
      "source_slug": "x-account-whale-alert",
      "source_name": "Whale Alert (X)",
      "source_type": "x_account",
      "source_url": "https://x.com/i/status/1879012345678901234",
      "title": "🚨 1,500 #BTC (183,200,000 USD) transferred from unknown wallet to #Binance",
      "body": null,
      "author": "@whale_alert",
      "published_at": "2025-01-15T14:28:00Z",
      "fetched_at": "2025-01-15T14:30:00Z",
      "raw_json": {
        "id": "1879012345678901234",
        "author_id": "979004436",
        "text": "🚨 1,500 #BTC (183,200,000 USD) transferred from unknown wallet to #Binance",
        "created_at": "2025-01-15T14:28:00Z",
        "public_metrics": { "retweet_count": 312, "like_count": 874 }
      }
    }
  ]
}
