{
  "source_id": "https://example.com/finance/fed-minutes",
  "source_name": "MarketWatch",
  "source_type": "rss",
  "source_url": "https://example.com/finance/fed-minutes",
  "title": "Fed minutes reveal no urgency to cut rates in Q1 2025",
  "body": "Minutes from the December FOMC meeting published on January 15 showed officials broadly agreed that there was no reason to lower the interest rate until inflation data showed sustained progress toward the 2% target.",
  "published_at": "2025-01-15T18:30:00Z",
  "fetched_at": "2025-01-15T18:45:00Z",
  "raw_json": {
    "guid": "https://example.com/finance/fed-minutes",
    "link": "https://example.com/finance/fed-minutes",
    "pubDate": "Wed, 15 Jan 2025 18:30:00 +0000",
    "category": ["Finance", "Federal Reserve", "Monetary Policy"]
  }
}
